{
  "world_ir_version": "0.1.0",
  "id": "example-dog-ran-zh-Hans",
  "source": {
    "text": "狗跑了。",
    "language": "zh-Hans",
    "channel": "text"
  },
  "utterance": {
    "kind": "assertion"
  },
  "entities": [
    {
      "id": "e1",
      "type": "animal",
      "concept": "DOG",
      "quantifier": {
        "kind": "definite"
      }
    }
  ],
  "frames": [
    {
      "id": "f1",
      "frame_type": "event",
      "predicate": "RUN",
      "roles": [
        {
          "role": "AGENT",
          "value": {
            "entity_ref": "e1"
          }
        }
      ],
      "polarity": "positive",
      "tense": "past",
      "aspect": "simple",
      "modality": "asserted",
      "certainty": 1.0
    }
  ],
  "links": [],
  "fidelity": {
    "status": "lossless",
    "lost_features": [],
    "notes": []
  }
}
